{
  "$schema": "../../docs/zh_cn/schemas/subsystem/subsystem_static_attr.schema.json",
  "type": "machine_max:engine",
  "basic_durability": 60,
  "max_power": 370000,
  "max_torque": 2500,
  "idle_rpm": 550,
  "max_torque_rpm": 1500,
  "red_line_rpm": 2200,
  "red_line_torque_ratio": 0.9,
  "inertia": 50,
  "cylinder": 6,
  "damping_factors": [
    5,
    0.05,
    0.00001
  ]
}